{
  "$schema": "https://questfoundry.liesdonk.nl/manifests/adapter_manifest.schema.json",
  "manifest_version": "2.0.0",
  "adapter_id": "player_narrator",
  "role_name": "Player-Narrator",
  "compiled_at": "2025-11-15T20:00:12.810853+00:00",
  "source_files": [
    "/home/runner/work/questfoundry/questfoundry/spec/05-behavior/adapters/player_narrator.adapter.yaml",
    "/home/runner/work/questfoundry/questfoundry/spec/05-behavior/expertises/player_narrator_performance.md",
    "/home/runner/work/questfoundry/questfoundry/spec/05-behavior/procedures/in_world_performance.md",
    "/home/runner/work/questfoundry/questfoundry/spec/05-behavior/procedures/diegetic_gate_enforcement.md",
    "/home/runner/work/questfoundry/questfoundry/spec/05-behavior/procedures/ux_issue_tagging.md",
    "/home/runner/work/questfoundry/questfoundry/spec/05-behavior/procedures/spoiler_hygiene.md",
    "/home/runner/work/questfoundry/questfoundry/spec/05-behavior/procedures/tu_lifecycle.md",
    "/home/runner/work/questfoundry/questfoundry/spec/05-behavior/procedures/artifact_validation.md",
    "/home/runner/work/questfoundry/questfoundry/spec/05-behavior/snippets/pn_safety_invariant.md",
    "/home/runner/work/questfoundry/questfoundry/spec/05-behavior/snippets/spoiler_hygiene_check.md",
    "/home/runner/work/questfoundry/questfoundry/spec/05-behavior/snippets/pn_boundaries.md",
    "/home/runner/work/questfoundry/questfoundry/spec/05-behavior/snippets/pn_safety_warning.md",
    "/home/runner/work/questfoundry/questfoundry/spec/05-behavior/snippets/validation_reminder.md"
  ],
  "mission": "Present choices clearly and enforce conditions in-world so players feel immersed, not managed.",
  "expertise": "@expertise:player_narrator_performance",
  "procedures": {
    "primary": [
      "@procedure:in_world_performance",
      "@procedure:diegetic_gate_enforcement",
      "@procedure:ux_issue_tagging"
    ],
    "supporting": [
      "@procedure:artifact_validation",
      "@procedure:spoiler_hygiene",
      "@procedure:tu_lifecycle"
    ]
  },
  "protocol_intents": {
    "receives": [
      "view.export.result",
      "tu.open"
    ],
    "sends": [
      "pn.playtest_notes",
      "pn.session_recap",
      "pn.friction.report",
      "ack"
    ]
  },
  "loops": [
    {
      "playbook": "@playbook:narration_dry_run",
      "raci": "responsible",
      "description": "Perform view; tag issues; provide player-safe feedback"
    },
    {
      "playbook": "@playbook:binding_run",
      "raci": "informed",
      "description": "Receives bundle for performance"
    },
    {
      "playbook": "@playbook:hook_harvest",
      "raci": "informed",
      "description": "Informed of hooks impacting future narration"
    },
    {
      "playbook": "@playbook:story_spark",
      "raci": "informed",
      "description": "Informed of topology changes for future narration"
    }
  ],
  "quality_bars": {
    "primary": [
      "presentation",
      "accessibility",
      "gateways"
    ],
    "secondary": [
      "style",
      "nonlinearity",
      "integrity"
    ]
  },
  "safety_protocols": [
    "@snippet:spoiler_hygiene_check",
    "@snippet:pn_safety_warning",
    "@snippet:validation_reminder",
    "@snippet:pn_boundaries",
    "@snippet:pn_safety_invariant"
  ],
  "handoffs": {
    "from_binder": {
      "content": "Receive view bundle (snapshot ID, included options)",
      "artifacts": [
        "view.export.result"
      ]
    },
    "to_showrunner": {
      "content": "Send playtest notes with tagged issues and locations",
      "artifacts": [
        "pn.playtest_notes"
      ]
    },
    "to_style_lead": {
      "content": "Report tone wobble and gate phrasing friction",
      "artifacts": [
        "pn.friction.report"
      ]
    },
    "to_gatekeeper": {
      "content": "Report Presentation issues for validation",
      "trigger": "Internals or spoilers detected in surfaces"
    },
    "from_style_lead": {
      "content": "Receive PN phrasing patterns for common gates/refusals",
      "artifacts": [
        "pn.phrasing.patterns"
      ]
    },
    "from_translator": {
      "content": "Receive localized phrasing for target language performance",
      "artifacts": [
        "translation_slices"
      ]
    }
  },
  "artifacts": [
    "playtest_notes.schema.json",
    "friction_report.schema.json"
  ]
}