{
  "$schema": "https://questfoundry.liesdonk.nl/manifests/adapter_manifest.schema.json",
  "manifest_version": "2.0.0",
  "adapter_id": "audio_producer",
  "role_name": "Audio Producer",
  "compiled_at": "2025-11-15T20:00:12.811886+00:00",
  "source_files": [
    "/home/runner/work/questfoundry/questfoundry/spec/05-behavior/adapters/audio_producer.adapter.yaml",
    "/home/runner/work/questfoundry/questfoundry/spec/05-behavior/expertises/audio_producer_generation.md",
    "/home/runner/work/questfoundry/questfoundry/spec/05-behavior/expertises/audio_producer_safety.md",
    "/home/runner/work/questfoundry/questfoundry/spec/05-behavior/procedures/dynamic_range_safety.md",
    "/home/runner/work/questfoundry/questfoundry/spec/05-behavior/procedures/audio_rendering.md",
    "/home/runner/work/questfoundry/questfoundry/spec/05-behavior/procedures/determinism_logging.md",
    "/home/runner/work/questfoundry/questfoundry/spec/05-behavior/procedures/spoiler_hygiene.md",
    "/home/runner/work/questfoundry/questfoundry/spec/05-behavior/procedures/tu_lifecycle.md",
    "/home/runner/work/questfoundry/questfoundry/spec/05-behavior/procedures/artifact_validation.md",
    "/home/runner/work/questfoundry/questfoundry/spec/05-behavior/snippets/spoiler_hygiene_check.md",
    "/home/runner/work/questfoundry/questfoundry/spec/05-behavior/snippets/safety_critical_audio.md",
    "/home/runner/work/questfoundry/questfoundry/spec/05-behavior/snippets/no_internals.md",
    "/home/runner/work/questfoundry/questfoundry/spec/05-behavior/snippets/accessibility.md",
    "/home/runner/work/questfoundry/questfoundry/spec/05-behavior/snippets/text_equivalents_captions.md",
    "/home/runner/work/questfoundry/questfoundry/spec/05-behavior/snippets/technique_off_surfaces.md",
    "/home/runner/work/questfoundry/questfoundry/spec/05-behavior/snippets/determinism.md",
    "/home/runner/work/questfoundry/questfoundry/spec/05-behavior/snippets/pn_safety_warning.md",
    "/home/runner/work/questfoundry/questfoundry/spec/05-behavior/snippets/validation_reminder.md"
  ],
  "mission": "Produce clean, reproducible audio cues from Audio Plans, with text equivalents and safety notes honored\u2014and keep the noise behind the curtain.",
  "expertise": "@expertise:audio_producer_generation",
  "procedures": {
    "primary": [
      "@procedure:audio_rendering",
      "@procedure:determinism_logging",
      "@procedure:dynamic_range_safety"
    ],
    "supporting": [
      "@procedure:artifact_validation",
      "@procedure:spoiler_hygiene",
      "@procedure:tu_lifecycle"
    ]
  },
  "protocol_intents": {
    "receives": [
      "audio.plan",
      "audio.revision.request"
    ],
    "sends": [
      "audio.render",
      "audio.determinism_log",
      "audio.mixdown_notes",
      "audio.safety_checklist",
      "audio.feasibility_note",
      "ack"
    ]
  },
  "loops": [
    {
      "playbook": "@playbook:audio_pass",
      "raci": "responsible",
      "description": "Render cues; maintain logs; coordinate with Director/Style/Gatekeeper"
    }
  ],
  "quality_bars": {
    "primary": [
      "integrity",
      "presentation",
      "accessibility"
    ],
    "secondary": [
      "determinism",
      "style"
    ]
  },
  "safety_protocols": [
    "@snippet:spoiler_hygiene_check",
    "@snippet:pn_safety_warning",
    "@snippet:validation_reminder",
    "@snippet:determinism",
    "@snippet:technique_off_surfaces",
    "@snippet:safety_critical_audio",
    "@snippet:text_equivalents_captions",
    "@snippet:accessibility",
    "@snippet:no_internals"
  ],
  "handoffs": {
    "from_audio_director": {
      "content": "Receive audio plans with specifications",
      "artifacts": [
        "audio.plan"
      ]
    },
    "to_audio_director": {
      "content": "Report feasibility issues or technical blockers",
      "artifacts": [
        "audio.feasibility_note"
      ]
    },
    "to_binder": {
      "content": "Deliver final renders and mix notes",
      "artifacts": [
        "audio.render",
        "audio.mixdown_notes"
      ]
    },
    "to_gatekeeper": {
      "content": "Submit for Integrity, Presentation, and Accessibility checks",
      "artifacts": [
        "audio.render",
        "audio.safety_checklist"
      ]
    },
    "coordinate_with_style_lead": {
      "content": "Stylistic/tone questions",
      "trigger": "Tonal palette alignment needed"
    },
    "coordinate_with_translator": {
      "content": "Caption timing and localization",
      "trigger": "Localized caption coordination needed"
    }
  },
  "artifacts": [
    "audio_render.schema.json",
    "determinism_log.schema.json",
    "safety_checklist.schema.json"
  ]
}