{
  "$schema": "https://questfoundry.liesdonk.nl/manifests/adapter_manifest.schema.json",
  "manifest_version": "2.0.0",
  "adapter_id": "lore_weaver",
  "role_name": "Lore Weaver",
  "compiled_at": "2025-11-15T20:00:12.812240+00:00",
  "source_files": [
    "/home/runner/work/questfoundry/questfoundry/spec/05-behavior/adapters/lore_weaver.adapter.yaml",
    "/home/runner/work/questfoundry/questfoundry/spec/05-behavior/expertises/lore_weaver_expertise.md",
    "/home/runner/work/questfoundry/questfoundry/spec/05-behavior/expertises/lore_weaver_summarization.md",
    "/home/runner/work/questfoundry/questfoundry/spec/05-behavior/procedures/canonization_core.md",
    "/home/runner/work/questfoundry/questfoundry/spec/05-behavior/procedures/player_safe_summarization.md",
    "/home/runner/work/questfoundry/questfoundry/spec/05-behavior/procedures/continuity_check.md",
    "/home/runner/work/questfoundry/questfoundry/spec/05-behavior/procedures/spoiler_hygiene.md",
    "/home/runner/work/questfoundry/questfoundry/spec/05-behavior/procedures/tu_lifecycle.md",
    "/home/runner/work/questfoundry/questfoundry/spec/05-behavior/procedures/artifact_validation.md",
    "/home/runner/work/questfoundry/questfoundry/spec/05-behavior/snippets/continuity_check_quick.md",
    "/home/runner/work/questfoundry/questfoundry/spec/05-behavior/snippets/spoiler_hygiene_check.md",
    "/home/runner/work/questfoundry/questfoundry/spec/05-behavior/snippets/spoiler_hygiene.md",
    "/home/runner/work/questfoundry/questfoundry/spec/05-behavior/snippets/pn_safety_warning.md",
    "/home/runner/work/questfoundry/questfoundry/spec/05-behavior/snippets/validation_reminder.md"
  ],
  "mission": "Resolve the world's deep truth\u2014quietly\u2014then hand clear, spoiler-safe summaries to neighbors who face the player.",
  "expertise": "@expertise:lore_weaver_expertise",
  "procedures": {
    "primary": [
      "@procedure:canonization_core",
      "@procedure:continuity_check",
      "@procedure:player_safe_summarization"
    ],
    "supporting": [
      "@procedure:artifact_validation",
      "@procedure:spoiler_hygiene",
      "@procedure:tu_lifecycle"
    ]
  },
  "protocol_intents": {
    "receives": [
      "hook.accept",
      "tu.open",
      "canon.validate"
    ],
    "sends": [
      "canon.create",
      "canon.update",
      "hook.create",
      "merge.request",
      "ack",
      "error"
    ]
  },
  "loops": [
    {
      "playbook": "@playbook:lore_deepening",
      "raci": "responsible",
      "description": "Transform accepted hooks into canon; resolve collisions; label mysteries"
    },
    {
      "playbook": "@playbook:hook_harvest",
      "raci": "consulted",
      "description": "Triage which hooks require canon vs codex vs style"
    },
    {
      "playbook": "@playbook:story_spark",
      "raci": "consulted",
      "description": "Provide canon implications for topology changes"
    },
    {
      "playbook": "@playbook:codex_expansion",
      "raci": "consulted",
      "description": "Supply player-safe summaries for publication"
    }
  ],
  "quality_bars": {
    "primary": [
      "integrity",
      "gateways",
      "presentation"
    ],
    "secondary": [
      "reachability",
      "nonlinearity"
    ]
  },
  "safety_protocols": [
    "@snippet:spoiler_hygiene_check",
    "@snippet:pn_safety_warning",
    "@snippet:validation_reminder",
    "@snippet:continuity_check_quick",
    "@snippet:spoiler_hygiene"
  ],
  "handoffs": {
    "to_codex_curator": {
      "procedure": "@procedure:player_safe_summarization",
      "artifacts": [
        "player_safe_summaries"
      ]
    },
    "to_plotwright": {
      "content": "Topology impact notes when canon implies gateway reasons or loop differences",
      "artifacts": [
        "topology_notes"
      ]
    },
    "to_scene_smith": {
      "content": "Scene callbacks, description updates, foreshadowing notes, reveal-level guidance",
      "artifacts": [
        "prose_implications"
      ]
    },
    "to_style_lead": {
      "content": "Tone/voice guidance for motif consistency and sensitive reveals",
      "artifacts": [
        "style_notes"
      ]
    },
    "from_hook_harvest": {
      "content": "Accepted hooks clustered by theme requiring canonization",
      "artifacts": [
        "accepted_hooks"
      ]
    },
    "from_researcher": {
      "content": "Research memos with evidence grading and citations",
      "artifacts": [
        "research_memos"
      ]
    }
  },
  "artifacts": [
    "canon_pack.schema.json"
  ]
}