{
  "$schema": "https://questfoundry.liesdonk.nl/manifests/adapter_manifest.schema.json",
  "manifest_version": "2.0.0",
  "adapter_id": "illustrator",
  "role_name": "Illustrator",
  "compiled_at": "2025-11-15T20:00:12.809529+00:00",
  "source_files": [
    "/home/runner/work/questfoundry/questfoundry/spec/05-behavior/adapters/illustrator.adapter.yaml",
    "/home/runner/work/questfoundry/questfoundry/spec/05-behavior/expertises/illustrator_generation.md",
    "/home/runner/work/questfoundry/questfoundry/spec/05-behavior/procedures/alt_text_creation.md",
    "/home/runner/work/questfoundry/questfoundry/spec/05-behavior/procedures/determinism_logging.md",
    "/home/runner/work/questfoundry/questfoundry/spec/05-behavior/procedures/image_rendering.md",
    "/home/runner/work/questfoundry/questfoundry/spec/05-behavior/procedures/spoiler_hygiene.md",
    "/home/runner/work/questfoundry/questfoundry/spec/05-behavior/procedures/tu_lifecycle.md",
    "/home/runner/work/questfoundry/questfoundry/spec/05-behavior/procedures/artifact_validation.md",
    "/home/runner/work/questfoundry/questfoundry/spec/05-behavior/snippets/spoiler_hygiene_check.md",
    "/home/runner/work/questfoundry/questfoundry/spec/05-behavior/snippets/no_internals.md",
    "/home/runner/work/questfoundry/questfoundry/spec/05-behavior/snippets/accessibility.md",
    "/home/runner/work/questfoundry/questfoundry/spec/05-behavior/snippets/technique_off_surfaces.md",
    "/home/runner/work/questfoundry/questfoundry/spec/05-behavior/snippets/determinism.md",
    "/home/runner/work/questfoundry/questfoundry/spec/05-behavior/snippets/alt_text_quality.md",
    "/home/runner/work/questfoundry/questfoundry/spec/05-behavior/snippets/pn_safety_warning.md",
    "/home/runner/work/questfoundry/questfoundry/spec/05-behavior/snippets/validation_reminder.md"
  ],
  "mission": "Realize the Art Director's plans as player-safe illustrations with clean captions, solid alt text, and reproducible logs kept off-surface.",
  "expertise": "@expertise:illustrator_generation",
  "procedures": {
    "primary": [
      "@procedure:image_rendering",
      "@procedure:alt_text_creation",
      "@procedure:determinism_logging"
    ],
    "supporting": [
      "@procedure:artifact_validation",
      "@procedure:spoiler_hygiene",
      "@procedure:tu_lifecycle"
    ]
  },
  "protocol_intents": {
    "receives": [
      "art.plan",
      "art.revision.request"
    ],
    "sends": [
      "art.render",
      "art.determinism_log",
      "art.feasibility_note",
      "hook.create",
      "ack"
    ]
  },
  "loops": [
    {
      "playbook": "@playbook:art_touch_up",
      "raci": "consulted",
      "description": "Render & feasibility feedback"
    }
  ],
  "quality_bars": {
    "primary": [
      "presentation",
      "accessibility"
    ],
    "secondary": [
      "integrity",
      "determinism"
    ]
  },
  "safety_protocols": [
    "@snippet:spoiler_hygiene_check",
    "@snippet:pn_safety_warning",
    "@snippet:validation_reminder",
    "@snippet:determinism",
    "@snippet:technique_off_surfaces",
    "@snippet:alt_text_quality",
    "@snippet:accessibility",
    "@snippet:no_internals"
  ],
  "handoffs": {
    "from_art_director": {
      "content": "Receive art plans with specifications",
      "artifacts": [
        "art.plan"
      ]
    },
    "to_art_director": {
      "content": "Report feasibility issues; propose alternates",
      "artifacts": [
        "art.feasibility_note"
      ]
    },
    "to_binder": {
      "content": "Deliver final renders with alt text",
      "artifacts": [
        "art.render"
      ]
    },
    "to_gatekeeper": {
      "content": "Submit for Presentation and Accessibility checks",
      "artifacts": [
        "art.render"
      ]
    },
    "coordinate_with_style_lead": {
      "content": "Caption tweaks (if any) cleared with Director/Style",
      "trigger": "Tone/register questions"
    },
    "coordinate_with_translator": {
      "content": "Caption timing and terminology",
      "trigger": "Localization coordination needed"
    }
  },
  "artifacts": [
    "art_render.schema.json",
    "determinism_log.schema.json"
  ]
}