{
  "$schema": "https://questfoundry.liesdonk.nl/manifests/adapter_manifest.schema.json",
  "manifest_version": "2.0.0",
  "adapter_id": "scene_smith",
  "role_name": "Scene Smith",
  "compiled_at": "2025-11-15T20:00:12.811526+00:00",
  "source_files": [
    "/home/runner/work/questfoundry/questfoundry/spec/05-behavior/adapters/scene_smith.adapter.yaml",
    "/home/runner/work/questfoundry/questfoundry/spec/05-behavior/expertises/scene_smith_prose_craft.md",
    "/home/runner/work/questfoundry/questfoundry/spec/05-behavior/procedures/spoiler_hygiene.md",
    "/home/runner/work/questfoundry/questfoundry/spec/05-behavior/procedures/artifact_validation.md",
    "/home/runner/work/questfoundry/questfoundry/spec/05-behavior/procedures/tu_lifecycle.md",
    "/home/runner/work/questfoundry/questfoundry/spec/05-behavior/procedures/human_question.md",
    "/home/runner/work/questfoundry/questfoundry/spec/05-behavior/snippets/diegetic_phrasing_guide.md",
    "/home/runner/work/questfoundry/questfoundry/spec/05-behavior/snippets/spoiler_hygiene_check.md",
    "/home/runner/work/questfoundry/questfoundry/spec/05-behavior/snippets/pn_safety_warning.md",
    "/home/runner/work/questfoundry/questfoundry/spec/05-behavior/snippets/no_internals.md",
    "/home/runner/work/questfoundry/questfoundry/spec/05-behavior/snippets/pn_boundaries.md",
    "/home/runner/work/questfoundry/questfoundry/spec/05-behavior/snippets/contrastive_choices.md",
    "/home/runner/work/questfoundry/questfoundry/spec/05-behavior/snippets/validation_reminder.md"
  ],
  "mission": "Write and revise section prose to briefs and style guardrails; integrate canon and choices.",
  "expertise": "@expertise:scene_smith_prose_craft",
  "procedures": {
    "primary": [
      "@procedure:spoiler_hygiene",
      "@procedure:artifact_validation"
    ],
    "supporting": [
      "@procedure:tu_lifecycle",
      "@procedure:human_question"
    ]
  },
  "protocol_intents": {
    "receives": [
      "tu.open",
      "scene.write",
      "scene.revise"
    ],
    "sends": [
      "tu.checkpoint",
      "scene.draft",
      "human.question",
      "ack"
    ]
  },
  "loops": [
    {
      "playbook": "@playbook:story_spark",
      "raci": "responsible",
      "description": "Draft and adjust affected sections; embed choices and state effects"
    },
    {
      "playbook": "@playbook:style_tune_up",
      "raci": "responsible",
      "description": "Revise prose per Style Lead audit; fix register/motif issues"
    },
    {
      "playbook": "@playbook:lore_deepening",
      "raci": "consulted",
      "description": "Note prose adjustments suggested by new canon"
    }
  ],
  "quality_bars": {
    "primary": [
      "style",
      "presentation",
      "gateways"
    ],
    "secondary": [
      "nonlinearity"
    ]
  },
  "safety_protocols": [
    "@snippet:spoiler_hygiene_check",
    "@snippet:diegetic_phrasing_guide",
    "@snippet:pn_safety_warning",
    "@snippet:contrastive_choices",
    "@snippet:pn_boundaries",
    "@snippet:no_internals",
    "@snippet:validation_reminder"
  ],
  "handoffs": {
    "from_lore_weaver": {
      "content": "Canon callbacks, foreshadowing notes, reveal-level guidance, PN-safe phrasing hints",
      "artifacts": [
        "prose_implications",
        "canon_callbacks"
      ]
    },
    "from_plotwright": {
      "content": "Topology adjustments, hub return cues, gateway specs, state effect requirements",
      "artifacts": [
        "topology_notes",
        "gateway_definitions"
      ]
    },
    "to_style_lead": {
      "content": "Request audit if tone wobble or major rephrase needed",
      "trigger": "Register uncertainty or voice inconsistency detected"
    },
    "to_gatekeeper": {
      "content": "Pre-gate when player surfaces being promoted",
      "artifacts": [
        "draft_scenes",
        "manuscript_sections"
      ]
    }
  },
  "artifacts": [
    "scene.schema.json",
    "edit_notes.schema.json"
  ]
}