{
  "$schema": "https://questfoundry.liesdonk.nl/manifests/adapter_manifest.schema.json",
  "manifest_version": "2.0.0",
  "adapter_id": "audio_director",
  "role_name": "Audio Director",
  "compiled_at": "2025-11-15T20:00:12.811026+00:00",
  "source_files": [
    "/home/runner/work/questfoundry/questfoundry/spec/05-behavior/adapters/audio_director.adapter.yaml",
    "/home/runner/work/questfoundry/questfoundry/spec/05-behavior/expertises/audio_director_planning.md",
    "/home/runner/work/questfoundry/questfoundry/spec/05-behavior/procedures/audio_plan_authoring.md",
    "/home/runner/work/questfoundry/questfoundry/spec/05-behavior/procedures/cue_slot_selection.md",
    "/home/runner/work/questfoundry/questfoundry/spec/05-behavior/procedures/leitmotif_management.md",
    "/home/runner/work/questfoundry/questfoundry/spec/05-behavior/procedures/spoiler_hygiene.md",
    "/home/runner/work/questfoundry/questfoundry/spec/05-behavior/procedures/tu_lifecycle.md",
    "/home/runner/work/questfoundry/questfoundry/spec/05-behavior/procedures/artifact_validation.md",
    "/home/runner/work/questfoundry/questfoundry/spec/05-behavior/snippets/spoiler_hygiene_check.md",
    "/home/runner/work/questfoundry/questfoundry/spec/05-behavior/snippets/safety_critical_audio.md",
    "/home/runner/work/questfoundry/questfoundry/spec/05-behavior/snippets/no_internals.md",
    "/home/runner/work/questfoundry/questfoundry/spec/05-behavior/snippets/accessibility.md",
    "/home/runner/work/questfoundry/questfoundry/spec/05-behavior/snippets/text_equivalents_captions.md",
    "/home/runner/work/questfoundry/questfoundry/spec/05-behavior/snippets/technique_off_surfaces.md",
    "/home/runner/work/questfoundry/questfoundry/spec/05-behavior/snippets/determinism.md",
    "/home/runner/work/questfoundry/questfoundry/spec/05-behavior/snippets/pn_safety_warning.md",
    "/home/runner/work/questfoundry/questfoundry/spec/05-behavior/snippets/validation_reminder.md"
  ],
  "mission": "Choose moments where sound clarifies, paces, or signals\u2014and specify them in player-safe plans with captions/text equivalents and safety notes.",
  "expertise": "@expertise:audio_director_planning",
  "procedures": {
    "primary": [
      "@procedure:cue_slot_selection",
      "@procedure:audio_plan_authoring",
      "@procedure:leitmotif_management"
    ],
    "supporting": [
      "@procedure:artifact_validation",
      "@procedure:spoiler_hygiene",
      "@procedure:tu_lifecycle"
    ]
  },
  "protocol_intents": {
    "receives": [
      "tu.open",
      "audio.cue.request",
      "feasibility.report"
    ],
    "sends": [
      "audio.plan",
      "audio.cuelist",
      "hook.create",
      "ack"
    ]
  },
  "loops": [
    {
      "playbook": "@playbook:audio_pass",
      "raci": "responsible",
      "description": "Select cues; author plans; coordinate with Style/Gatekeeper/PN/Translator"
    }
  ],
  "quality_bars": {
    "primary": [
      "presentation",
      "accessibility"
    ],
    "secondary": [
      "style",
      "gateways"
    ]
  },
  "safety_protocols": [
    "@snippet:spoiler_hygiene_check",
    "@snippet:pn_safety_warning",
    "@snippet:validation_reminder",
    "@snippet:determinism",
    "@snippet:technique_off_surfaces",
    "@snippet:safety_critical_audio",
    "@snippet:text_equivalents_captions",
    "@snippet:accessibility",
    "@snippet:no_internals"
  ],
  "handoffs": {
    "to_audio_producer": {
      "content": "Send audio plans for rendering; coordinate feasibility",
      "artifacts": [
        "audio.plan"
      ]
    },
    "to_style_lead": {
      "content": "Coordinate caption phrasing and register",
      "trigger": "Caption language decisions needed"
    },
    "to_translator": {
      "content": "Coordinate caption portability across languages",
      "artifacts": [
        "caption_notes"
      ]
    },
    "to_player_narrator": {
      "content": "Coordinate cadence impacts",
      "trigger": "Audio affects narrative pacing"
    },
    "from_any_role": {
      "content": "Receive requests for audio clarification or pacing",
      "artifacts": [
        "audio.cue.request"
      ]
    },
    "from_audio_producer": {
      "content": "Receive feasibility reports; adjust plans as needed",
      "artifacts": [
        "feasibility.report"
      ]
    }
  },
  "artifacts": [
    "audio_plan.schema.json",
    "cuelist.schema.json"
  ]
}